{
  "meta": {
    "rig_id": "field-rig-v1",
    "name": "Primary Field Rig",
    "description": "The physical hardware wired into the two-objective board plus one spare prop LED and one spare haptic motor. This file is theme-neutral on purpose - it is reused unchanged by every theme file.",
    "_comment": "Edit THIS file when you physically add/move/replace hardware. Do not add game meaning here (no 'alarm_led', no 'team_1_led') - that mapping lives in each theme's hardware_aliases block instead, so the same wire can play different roles in different themes."
  },

  "leds": [
    {
      "id": "led_1",
      "device_id": "strip0:pixel12",
      "supports_rgb": true,
      "location_note": "Objective A marker, north table position"
    },
    {
      "id": "led_2",
      "device_id": "strip0:pixel24",
      "supports_rgb": true,
      "location_note": "Objective B marker, south table position"
    },
    {
      "id": "led_3",
      "device_id": "gpio17",
      "supports_rgb": false,
      "location_note": "Spare single-color indicator mounted on the control console. Not RGB - single color only, so themes should only ever ask this one for on/off/blink, not a specific color.",
      "_comment": "This is the LED that plays 'alarm_led' in reactor-meltdown and 'briefcase_led' (RGB fallback: treated as amber-only) in arms-deal. Swap in an RGB module later and just flip supports_rgb to true - no theme file needs to change."
    }
  ],

  "oled_screens": [
    {
      "id": "oled_1",
      "device_id": "i2c:0x3C",
      "width_px": 128,
      "height_px": 64,
      "location_note": "Mounted above Objective A"
    },
    {
      "id": "oled_2",
      "device_id": "i2c:0x3D",
      "width_px": 128,
      "height_px": 64,
      "location_note": "Mounted above Objective B"
    }
  ],

  "audio_outputs": [
    {
      "id": "speaker_1",
      "device_id": "audio0",
      "location_note": "Main field speaker, mounted center"
    }
  ],

  "haptics": [
    {
      "id": "haptic_1",
      "device_id": "gpio22",
      "location_note": "Motor embedded in the control console housing"
    },
    {
      "id": "haptic_2",
      "device_id": "gpio23",
      "location_note": "Motor embedded in the spare prop (briefcase / detonator / whatever theme needs a rumbling prop)"
    }
  ]
}
